{
  "schema_version": "browser-workbench.run/v1",
  "run_id": "servo-gtk-experimental",
  "backend": {"kind": "servo-gtk", "variant": "pinned-d366e11", "expected_identity": {"revision": "d366e11a41e042cc08f94004f28dba67f83b11a5"}},
  "required_capabilities": ["session.create", "page.navigate"],
  "allowed_providers": ["engine", "host"],
  "workflow": [
    {"step_id": "create", "method": "session.create", "params": {"client": {"id": "servo-research", "kind": "tool"}, "profile": {"mode": "ephemeral", "name": "servo-research"}}},
    {"step_id": "navigate", "method": "page.navigate", "params": {"page_id": "page-1", "client_id": "servo-research", "url": "https://fixture.invalid/title-a"}}
  ],
  "gates": [
    {"id": "contract", "kind": "contract", "required": true},
    {"id": "capability", "kind": "capability", "required": true},
    {"id": "evidence", "kind": "evidence", "required": true}
  ],
  "policy": {"mutation": "forbid", "profile": "ephemeral", "single_writer": true},
  "evidence": {"raw": true, "normalized": true, "max_artifact_bytes": 1048576}
}
